======================================================================
ComfyUI Metadata Validation
======================================================================
Workflow Dir: C:\StableDiffusion\StabilityMatrix-win-x64\Data\Packages\ComfyUI\custom_nodes\ComfyUI_SaveImageWithMetaDataUniversal\tests\comfyui_cli_tests\dev_test_workflows
Output Dir:   C:\StableDiffusion\StabilityMatrix-win-x64\Data\Packages\ComfyUI_windows_portable\ComfyUI\output\Test
======================================================================
⚠ Hash validation disabled: pass --models-path to enable sidecar checks

Scanning for images...
Found 5 total image(s) in output directory

Validating workflow: 1-scan-and-save-custom-metadata-rules.json
  ℹ Info: This workflow generates metadata rules, not images (skipping)

Validating workflow: efficiency-nodes-debug-hash.json
  Found 3 Save Image node(s)
  Filename patterns: eff_adv, eff_xl, eff_basic, eff-without-meta
  Found 5 matching image(s)
    ✓ eff-without-meta_00001_.png (0 checks)
        Warning: Control image (without-meta) - no metadata expected
    ✗ eff_adv_00001_.png (16 checks)
        Error: Lora_0 Strength clip mismatch: expected '0.88', got '0.51'
        Error: Lora_1 Strength model mismatch: expected '0.6', got '1.0'
        Error: Lora_1 Strength clip mismatch: expected '0.51', got '0.02'
        Error: Field 'VAE hash' contains 'N/A' value: N/A
        Error: VAE hash is 'N/A' - hash should always be computed
    ✗ eff_basic_00001_.png (8 checks)
        Error: Field 'VAE hash' contains 'N/A' value: N/A
        Error: VAE hash is 'N/A' - hash should always be computed
    ✗ eff_xl_00001_.png (12 checks)
        Error: Lora_0 Strength model mismatch: expected '0.97', got '1.0'
        Error: Field 'VAE hash' contains 'N/A' value: N/A
        Error: VAE hash is 'N/A' - hash should always be computed
    ✗ eff_xl_00002_.png (12 checks)
        Error: Lora_0 Strength model mismatch: expected '0.97', got '1.0'
        Error: Field 'VAE hash' contains 'N/A' value: N/A
        Error: VAE hash is 'N/A' - hash should always be computed

Validating workflow: efficiency-nodes.json
  Found 3 Save Image node(s)
  Filename patterns: eff_adv, eff_xl, eff_basic, eff-without-meta
  Found 5 matching image(s)
    ✓ eff-without-meta_00001_.png (0 checks)
        Warning: Control image (without-meta) - no metadata expected
    ✗ eff_adv_00001_.png (16 checks)
        Error: Lora_0 Strength clip mismatch: expected '0.88', got '0.51'
        Error: Lora_1 Strength model mismatch: expected '0.6', got '1.0'
        Error: Lora_1 Strength clip mismatch: expected '0.51', got '0.02'
        Error: Field 'VAE hash' contains 'N/A' value: N/A
        Error: VAE hash is 'N/A' - hash should always be computed
    ✗ eff_basic_00001_.png (8 checks)
        Error: Field 'VAE hash' contains 'N/A' value: N/A
        Error: VAE hash is 'N/A' - hash should always be computed
    ✗ eff_xl_00001_.png (12 checks)
        Error: Lora_0 Strength model mismatch: expected '0.97', got '1.0'
        Error: Field 'VAE hash' contains 'N/A' value: N/A
        Error: VAE hash is 'N/A' - hash should always be computed
    ✗ eff_xl_00002_.png (12 checks)
        Error: Lora_0 Strength model mismatch: expected '0.97', got '1.0'
        Error: Field 'VAE hash' contains 'N/A' value: N/A
        Error: VAE hash is 'N/A' - hash should always be computed

Validating workflow: embedding_lora_vae_upscale_dual_sampler-id.json
  Found 1 Save Image node(s)
  Filename patterns: Embedding-Vae-id
  ⚠ Warning: No matching images found for this workflow

Validating workflow: embedding_lora_vae_upscale_dual_sampler-near.json
  Found 1 Save Image node(s)
  Filename patterns: Embedding-Vae-near
  ⚠ Warning: No matching images found for this workflow

Validating workflow: embedding_lora_vae_upscale_dual_sampler.json
  Found 1 Save Image node(s)
  Filename patterns: Embedding-Vae, Embedding-without-meta
  ⚠ Warning: No matching images found for this workflow

Validating workflow: extra_metadata_clip_skip.json
  Found 1 Save Image node(s)
  Filename patterns: extra_metadata_clip_skip
  ⚠ Warning: No matching images found for this workflow

Validating workflow: filename_format_denoise.json
  Found 1 Save Image node(s)
  Filename patterns: siwm
  ⚠ Warning: No matching images found for this workflow

Validating workflow: flux-civsampler-GCFG-lora-summary-batch3-turbo.json
  Found 1 Save Image node(s)
  Filename patterns: Flux-batch3-LoRA-summ-GCFG
  ⚠ Warning: No matching images found for this workflow

Validating workflow: flux-CR-LoRA-stack-ClownsharK.json
  Found 1 Save Image node(s)
  Filename patterns: flux-CR-LoRA-stack-ClownsharK
  ⚠ Warning: No matching images found for this workflow

Validating workflow: flux-dual-clip-turbo.json
  Found 1 Save Image node(s)
  Filename patterns: Flux-dual-clip
  ⚠ Warning: No matching images found for this workflow

Validating workflow: flux-eff-LoRA-stack-ClownsharK.json
  Found 1 Save Image node(s)
  Filename patterns: flux-eff-LoRA-stack-ClownsharK
  ⚠ Warning: No matching images found for this workflow

Validating workflow: flux-PC-LoRA-inline-Inspire-KSampler.json
  Found 1 Save Image node(s)
  Filename patterns: flux-PC-LoRA-inline-Inspire-KSampler
  ⚠ Warning: No matching images found for this workflow

Validating workflow: flux-turbo.json
  Found 1 Save Image node(s)
  Filename patterns: Flux-turbo-basic
  ⚠ Warning: No matching images found for this workflow

Validating workflow: large-workflow-jpeg-1kb.json
  Found 1 Save Image node(s)
  Filename patterns: Large-Workflow-jpeg-1kb
  ⚠ Warning: No matching images found for this workflow

Validating workflow: large-workflow-jpeg-60kb.json
  Found 1 Save Image node(s)
  Filename patterns: Large-Workflow-jpeg-60kb
  ⚠ Warning: No matching images found for this workflow

Validating workflow: large-workflow-png.json
  Found 1 Save Image node(s)
  Filename patterns: Large-Workflow-png
  ⚠ Warning: No matching images found for this workflow

Validating workflow: large-workflow-webp.json
  Found 1 Save Image node(s)
  Filename patterns: Large-Workflow-webp
  ⚠ Warning: No matching images found for this workflow

Validating workflow: lora-USO-Style-and-or-Subject-transfer-turbo.json
  Found 1 Save Image node(s)
  Filename patterns: USO
  ⚠ Warning: No matching images found for this workflow

Validating workflow: qwen_image_edit_2509.json
  Found 1 Save Image node(s)
  Filename patterns: Qwen-Edit
  ⚠ Warning: No matching images found for this workflow

Validating workflow: wan21_text_to_image_sage.json
  Found 1 Save Image node(s)
  Filename patterns: Wan21
  ⚠ Warning: No matching images found for this workflow

======================================================================
Validation Summary:
  Total Images Validated: 10
  ✓ Passed:               2
  ✗ Failed:               8
  ⚠ Unmatched Images:     0
  ⚠ Unmatched Workflows:  18
======================================================================

Unmatched Workflows (18):
  - embedding_lora_vae_upscale_dual_sampler-id.json
  - embedding_lora_vae_upscale_dual_sampler-near.json
  - embedding_lora_vae_upscale_dual_sampler.json
  - extra_metadata_clip_skip.json
  - filename_format_denoise.json
  - flux-CR-LoRA-stack-ClownsharK.json
  - flux-PC-LoRA-inline-Inspire-KSampler.json
  - flux-civsampler-GCFG-lora-summary-batch3-turbo.json
  - flux-dual-clip-turbo.json
  - flux-eff-LoRA-stack-ClownsharK.json
  - flux-turbo.json
  - large-workflow-jpeg-1kb.json
  - large-workflow-jpeg-60kb.json
  - large-workflow-png.json
  - large-workflow-webp.json
  - lora-USO-Style-and-or-Subject-transfer-turbo.json
  - qwen_image_edit_2509.json
  - wan21_text_to_image_sage.json

Failed Images:
  - eff_adv_00001_.png (workflow: efficiency-nodes-debug-hash)
      Lora_0 Strength clip mismatch: expected '0.88', got '0.51'
      Lora_1 Strength model mismatch: expected '0.6', got '1.0'
      Lora_1 Strength clip mismatch: expected '0.51', got '0.02'
      Field 'VAE hash' contains 'N/A' value: N/A
      VAE hash is 'N/A' - hash should always be computed
  - eff_basic_00001_.png (workflow: efficiency-nodes-debug-hash)
      Field 'VAE hash' contains 'N/A' value: N/A
      VAE hash is 'N/A' - hash should always be computed
  - eff_xl_00001_.png (workflow: efficiency-nodes-debug-hash)
      Lora_0 Strength model mismatch: expected '0.97', got '1.0'
      Field 'VAE hash' contains 'N/A' value: N/A
      VAE hash is 'N/A' - hash should always be computed
  - eff_xl_00002_.png (workflow: efficiency-nodes-debug-hash)
      Lora_0 Strength model mismatch: expected '0.97', got '1.0'
      Field 'VAE hash' contains 'N/A' value: N/A
      VAE hash is 'N/A' - hash should always be computed
  - eff_adv_00001_.png (workflow: efficiency-nodes)
      Lora_0 Strength clip mismatch: expected '0.88', got '0.51'
      Lora_1 Strength model mismatch: expected '0.6', got '1.0'
      Lora_1 Strength clip mismatch: expected '0.51', got '0.02'
      Field 'VAE hash' contains 'N/A' value: N/A
      VAE hash is 'N/A' - hash should always be computed
  - eff_basic_00001_.png (workflow: efficiency-nodes)
      Field 'VAE hash' contains 'N/A' value: N/A
      VAE hash is 'N/A' - hash should always be computed
  - eff_xl_00001_.png (workflow: efficiency-nodes)
      Lora_0 Strength model mismatch: expected '0.97', got '1.0'
      Field 'VAE hash' contains 'N/A' value: N/A
      VAE hash is 'N/A' - hash should always be computed
  - eff_xl_00002_.png (workflow: efficiency-nodes)
      Lora_0 Strength model mismatch: expected '0.97', got '1.0'
      Field 'VAE hash' contains 'N/A' value: N/A
      VAE hash is 'N/A' - hash should always be computed
======================================================================
