======================================================================
ComfyUI Metadata Validation
======================================================================
Workflow Dir: C:\StableDiffusion\StabilityMatrix-win-x64\Data\Packages\ComfyUI\custom_nodes\ComfyUI_SaveImageWithMetaDataUniversal\tests\comfyui_cli_tests\dev_test_workflows
Output Dir:   C:\StableDiffusion\StabilityMatrix-win-x64\Data\Packages\ComfyUI\output\Test
======================================================================

Scanning for images...
Found 23 total image(s) in output directory

Validating workflow: efficiency-nodes.json
  Found 3 Save Image node(s)
  Filename patterns: eff_adv, eff_xl, eff_basic, eff_without_meta
  Found 3 matching image(s)
    ✗ eff_adv_00001_.png (24 checks)
        Error: LoRA count mismatch: expected 2 LoRAs, got 0
        Error: Expected LoRA 0 ('LoRA\sd15\zelda\Majora_Zelda.safetensors') not found in metadata
        Error: Expected LoRA 1 ('LoRA\sd15\zelda\ootlink-nvwls-v1.safetensors') not found in metadata
    ✗ eff_basic_00001_.png (24 checks)
        Error: Seed mismatch: expected '456', got '123'
        Error: Steps mismatch: expected '25', got '20'
        Error: LoRA count mismatch: expected 2 LoRAs, got 0
        Error: Expected LoRA 0 ('LoRA\sd15\zelda\Majora_Zelda.safetensors') not found in metadata
        Error: Expected LoRA 1 ('LoRA\sd15\zelda\ootlink-nvwls-v1.safetensors') not found in metadata
    ✗ eff_xl_00001_.png (24 checks)
        Error: Seed mismatch: expected '456', got '789'
        Error: Steps mismatch: expected '25', got '20'
        Error: Model mismatch: expected 'cyberrealistic_v50', got 'Juggernaut_X_RunDiffusion'
        Error: Clip skip mismatch: expected '1', got '2'
        Error: LoRA count mismatch: expected 2 LoRAs, got 0
        Error: Expected LoRA 0 ('LoRA\sd15\zelda\Majora_Zelda.safetensors') not found in metadata
        Error: Expected LoRA 1 ('LoRA\sd15\zelda\ootlink-nvwls-v1.safetensors') not found in metadata
        Warning: Size mismatch: expected '1024x1024', got '832x1216'

Validating workflow: embedding_lora_vae_upscale_dual_sampler-id.json
  Found 1 Save Image node(s)
  Filename patterns: Embedding_Vae_id
  ⚠ Warning: No matching images found for this workflow

Validating workflow: embedding_lora_vae_upscale_dual_sampler-near.json
  Found 1 Save Image node(s)
  Filename patterns: Embedding_Vae_near
  ⚠ Warning: No matching images found for this workflow

Validating workflow: embedding_lora_vae_upscale_dual_sampler.json
  Found 1 Save Image node(s)
  Filename patterns: Embedding_Vae, Embedding_without_meta
  ⚠ Warning: No matching images found for this workflow

Validating workflow: extra_metadata_clip_skip.json
  Found 1 Save Image node(s)
  Filename patterns: extra_metadata_clip_skip
  Found 1 matching image(s)
    ✓ extra_metadata_clip_skip_00001_.png (21 checks)
        Steps: 20
        Sampler: euler_ancestral Karras
        Seed: 999999999999999

Validating workflow: filename_format_denoise.json
  Found 1 Save Image node(s)
  Filename patterns: siwm
  Found 1 matching image(s)
    ✓ 123-512x512_20251113-020105-siwm_00001_.png (21 checks)
        Steps: 20
        Sampler: dpmpp_2m Karras
        Seed: 123

Validating workflow: flux-civsampler-GCFG-lora-summary-batch3-turbo.json
  Found 1 Save Image node(s)
  Filename patterns: Flux_batch3_LoRA_summ_GCFG
  ⚠ Warning: No matching images found for this workflow

Validating workflow: flux-CR-LoRA-stack-ClownsharK.json
  Found 1 Save Image node(s)
  Filename patterns: flux_CR_LoRA_stack_ClownsharK
  ⚠ Warning: No matching images found for this workflow

Validating workflow: flux-dual-clip-turbo.json
  Found 1 Save Image node(s)
  Filename patterns: Flux_dual_clip
  ⚠ Warning: No matching images found for this workflow

Validating workflow: flux-eff-LoRA-stack-ClownsharK.json
  Found 1 Save Image node(s)
  Filename patterns: flux_eff_LoRA_stack_ClownsharK
  ⚠ Warning: No matching images found for this workflow

Validating workflow: flux-PC-LoRA-inline-Inspire-KSampler.json
  Found 1 Save Image node(s)
  Filename patterns: flux_PC_LoRA_inline_Inspire_KSampler
  ⚠ Warning: No matching images found for this workflow

Validating workflow: flux-turbo.json
  Found 1 Save Image node(s)
  Filename patterns: Flux_turbo_basic
  ⚠ Warning: No matching images found for this workflow

Validating workflow: large-workflow-jpeg-1kb.json
  Found 1 Save Image node(s)
  Filename patterns: Large_Workflow_jpeg_1kb
  ⚠ Warning: No matching images found for this workflow

Validating workflow: large-workflow-jpeg-60kb.json
  Found 1 Save Image node(s)
  Filename patterns: Large_Workflow_jpeg_60kb
  ⚠ Warning: No matching images found for this workflow

Validating workflow: large-workflow-png.json
  Found 1 Save Image node(s)
  Filename patterns: Large_Workflow_png
  ⚠ Warning: No matching images found for this workflow

Validating workflow: large-workflow-webp.json
  Found 1 Save Image node(s)
  Filename patterns: Large_Workflow_webp
  ⚠ Warning: No matching images found for this workflow

Validating workflow: lora-USO-Style-and-or-Subject-transfer-turbo.json
  Found 1 Save Image node(s)
  Filename patterns: USO
  Found 1 matching image(s)
    ✓ 2025-11-13-020756-USO_00001_.png (16 checks)
        Steps: 8
        Sampler: euler_simple
        Seed: 107768765971338

======================================================================
Validation Summary:
  Total Images Validated: 6
  ✓ Passed:               3
  ✗ Failed:               3
  ⚠ Unmatched Images:     17
  ⚠ Unmatched Workflows:  15
======================================================================

Unmatched Images (17):
  - 2025-11-13-020255-Flux-batch3-LoRA-summ-GCFG_00001_.png
  - 2025-11-13-020255-Flux-batch3-LoRA-summ-GCFG_00002_.png
  - 2025-11-13-020255-Flux-batch3-LoRA-summ-GCFG_00003_.png
  - 2025-11-13-020422-Flux-dual-clip_00001_.png
  - 2025-11-13-020603-Flux-turbo-basic_00001_.png
  - eff-without-meta_00001_.png
  - Embedding-Vae-id_00001_.png
  - Embedding-Vae-near_00001_.png
  - Embedding-Vae_00001_.png
  - Embedding-without-meta_00001_.png
  - flux-CR-LoRA-stack-ClownsharK_00001_.png
  - flux-eff-LoRA-stack-ClownsharK_00001_.png
  - flux-PC-LoRA-inline-Inspire-KSampler_00001_.png
  - Large-Workflow-jpeg-1kb_00001_.jpeg
  - Large-Workflow-jpeg-60kb_00001_.jpeg
  - Large-Workflow-png_00001_.png
  - Large-Workflow-webp_00001_.webp

Unmatched Workflows (15):
  - embedding_lora_vae_upscale_dual_sampler-id.json
  - embedding_lora_vae_upscale_dual_sampler-near.json
  - embedding_lora_vae_upscale_dual_sampler.json
  - flux-CR-LoRA-stack-ClownsharK.json
  - flux-PC-LoRA-inline-Inspire-KSampler.json
  - flux-civsampler-GCFG-lora-summary-batch3-turbo.json
  - flux-dual-clip-turbo.json
  - flux-eff-LoRA-stack-ClownsharK.json
  - flux-turbo.json
  - large-workflow-jpeg-1kb.json
  - large-workflow-jpeg-60kb.json
  - large-workflow-png.json
  - large-workflow-webp.json

Failed Images:
  - eff_adv_00001_.png (workflow: efficiency-nodes)
      LoRA count mismatch: expected 2 LoRAs, got 0
      Expected LoRA 0 ('LoRA\sd15\zelda\Majora_Zelda.safetensors') not found in metadata
      Expected LoRA 1 ('LoRA\sd15\zelda\ootlink-nvwls-v1.safetensors') not found in metadata
  - eff_basic_00001_.png (workflow: efficiency-nodes)
      Seed mismatch: expected '456', got '123'
      Steps mismatch: expected '25', got '20'
      LoRA count mismatch: expected 2 LoRAs, got 0
      Expected LoRA 0 ('LoRA\sd15\zelda\Majora_Zelda.safetensors') not found in metadata
      Expected LoRA 1 ('LoRA\sd15\zelda\ootlink-nvwls-v1.safetensors') not found in metadata
  - eff_xl_00001_.png (workflow: efficiency-nodes)
      Seed mismatch: expected '456', got '789'
      Steps mismatch: expected '25', got '20'
      Model mismatch: expected 'cyberrealistic_v50', got 'Juggernaut_X_RunDiffusion'
      Clip skip mismatch: expected '1', got '2'
      LoRA count mismatch: expected 2 LoRAs, got 0
      Expected LoRA 0 ('LoRA\sd15\zelda\Majora_Zelda.safetensors') not found in metadata
      Expected LoRA 1 ('LoRA\sd15\zelda\ootlink-nvwls-v1.safetensors') not found in metadata
======================================================================
